{
  "schemaVersion": 1,
  "name": "source-windows-core10",
  "level": "source",
  "platform": "windows-amd64",
  "core": {
    "ref": "ed63e94de814ff1d4ea28cddfaba6939bc9df9ed",
    "treeSha256": "ea6b4a04be6a1459caa1e9e23d3c59659a7c6cf65f39cb0222690602d2b77e34"
  },
  "inputs": {
    "core-source": {
      "path": "vendor/checksums.json",
      "sha256": "9c1fd83092d8eab0ce28d5e68e4a76f016e6080d7b444ecd627c67aa7a2b6d91"
    },
    "fixture-manifest": {
      "path": "tests/core-features/fixtures/manifest.json",
      "sha256": "272ca7c91544ed95982d6be125da715af958b7f89e3e3bb0aa1666f3d9f71bdf"
    },
    "baseline-evidence": {
      "path": "docs/测试/luna/LUNA-CORE-00/evidence.md",
      "sha256": "b21fb181b755d6ad9e39ac15167799d734f38918d2fdeed92f17157363bdbc73"
    },
    "feature-contract": {
      "path": "docs/协议/core-feature-contract.json",
      "sha256": "1471a765b99385ec9d442dfe9fdd2a1b6db11c4a96c0012fd84f14384e10a2b2"
    },
    "feature-profile-schema": {
      "path": "docs/协议/feature-profile.schema.json",
      "sha256": "e8b3817aa04f9afc5897f0554a61b5c02f720f3347225067e35d8b1a08a3702a"
    },
    "build-deps-lock": {
      "path": "config/feature-runtime-deps.lock.json",
      "sha256": "9deee698229898e7b9fadf457a08a101e43708a0fd9150ff16d9173ad713b13e"
    },
    "build-deps-schema": {
      "path": "config/feature-runtime-deps.schema.json",
      "sha256": "5f29acbfa0de658298753b8b502550d3d60caffbd4d687b78bf8875fca09eaa9"
    }
  }
}
